{
  "project": {
    "name": "Data Migration",
    "start_date": "2026-02-02",
    "end_date": "2026-05-15",
    "time_unit": "week",
    "show_weekends": true
  },
  "workstreams": [
    {"id": "planning", "name": "Planning", "color": "#4285F4"},
    {"id": "extract", "name": "Data Extract", "color": "#34A853"},
    {"id": "transform", "name": "Transform", "color": "#FBBC04"},
    {"id": "load", "name": "Data Load", "color": "#EA4335"},
    {"id": "validation", "name": "Validation", "color": "#9C27B0"}
  ],
  "tasks": [
    {
      "id": "plan1",
      "name": "Requirements Gathering",
      "workstream": "planning",
      "start": "2026-02-02",
      "end": "2026-02-13",
      "owner": "Alice",
      "status": "complete",
      "percent_complete": 100
    },
    {
      "id": "plan2",
      "name": "Migration Strategy",
      "workstream": "planning",
      "start": "2026-02-16",
      "end": "2026-02-27",
      "owner": "Alice",
      "status": "in_progress",
      "percent_complete": 50
    },
    {
      "id": "ext1",
      "name": "Source System Analysis",
      "workstream": "extract",
      "start": "2026-02-09",
      "end": "2026-02-20",
      "owner": "Bob",
      "status": "in_progress",
      "percent_complete": 70
    },
    {
      "id": "ext2",
      "name": "Extract Scripts Development",
      "workstream": "extract",
      "start": "2026-02-23",
      "end": "2026-03-13",
      "owner": "Bob",
      "status": "not_started",
      "percent_complete": 0
    },
    {
      "id": "ext3",
      "name": "Data Extraction",
      "workstream": "extract",
      "start": "2026-03-16",
      "end": "2026-03-27",
      "owner": "Bob",
      "status": "not_started",
      "percent_complete": 0
    },
    {
      "id": "trans1",
      "name": "Mapping Rules Definition",
      "workstream": "transform",
      "start": "2026-02-23",
      "end": "2026-03-06",
      "owner": "Carol",
      "status": "not_started",
      "percent_complete": 0
    },
    {
      "id": "trans2",
      "name": "Transform Pipeline",
      "workstream": "transform",
      "start": "2026-03-09",
      "end": "2026-03-27",
      "owner": "Carol",
      "status": "not_started",
      "percent_complete": 0
    },
    {
      "id": "trans3",
      "name": "Data Transformation",
      "workstream": "transform",
      "start": "2026-03-30",
      "end": "2026-04-10",
      "owner": "Carol",
      "status": "not_started",
      "percent_complete": 0
    },
    {
      "id": "load1",
      "name": "Target Schema Setup",
      "workstream": "load",
      "start": "2026-03-02",
      "end": "2026-03-13",
      "owner": "David",
      "status": "not_started",
      "percent_complete": 0
    },
    {
      "id": "load2",
      "name": "Load Scripts Development",
      "workstream": "load",
      "start": "2026-03-16",
      "end": "2026-04-03",
      "owner": "David",
      "status": "not_started",
      "percent_complete": 0
    },
    {
      "id": "load3",
      "name": "Data Loading",
      "workstream": "load",
      "start": "2026-04-13",
      "end": "2026-04-24",
      "owner": "David",
      "status": "not_started",
      "percent_complete": 0
    },
    {
      "id": "val1",
      "name": "Validation Rules",
      "workstream": "validation",
      "start": "2026-03-23",
      "end": "2026-04-03",
      "owner": "Eve",
      "status": "not_started",
      "percent_complete": 0
    },
    {
      "id": "val2",
      "name": "Data Validation",
      "workstream": "validation",
      "start": "2026-04-27",
      "end": "2026-05-08",
      "owner": "Eve",
      "status": "not_started",
      "percent_complete": 0
    },
    {
      "id": "val3",
      "name": "Sign-off",
      "workstream": "validation",
      "start": "2026-05-11",
      "end": "2026-05-15",
      "owner": "Eve",
      "status": "not_started",
      "percent_complete": 0
    }
  ],
  "milestones": [
    {
      "id": "ms1",
      "name": "Planning Complete",
      "date": "2026-02-27",
      "workstream": "planning",
      "status": "on_track"
    },
    {
      "id": "ms2",
      "name": "Extract Complete",
      "date": "2026-03-27",
      "workstream": "extract",
      "status": "on_track"
    },
    {
      "id": "ms3",
      "name": "Transform Complete",
      "date": "2026-04-10",
      "workstream": "transform",
      "status": "on_track"
    },
    {
      "id": "ms4",
      "name": "Migration Complete",
      "date": "2026-05-15",
      "workstream": "validation",
      "status": "on_track"
    }
  ],
  "dependencies": [
    {"from": "plan1", "to": "plan2", "type": "finish_to_start"},
    {"from": "plan2", "to": "ms1", "type": "finish_to_start"},
    {"from": "ext1", "to": "ext2", "type": "finish_to_start"},
    {"from": "ext2", "to": "ext3", "type": "finish_to_start"},
    {"from": "ext3", "to": "ms2", "type": "finish_to_start"},
    {"from": "trans1", "to": "trans2", "type": "finish_to_start"},
    {"from": "trans2", "to": "trans3", "type": "finish_to_start"},
    {"from": "trans3", "to": "ms3", "type": "finish_to_start"},
    {"from": "load1", "to": "load2", "type": "finish_to_start"},
    {"from": "load2", "to": "load3", "type": "finish_to_start"},
    {"from": "val1", "to": "val2", "type": "finish_to_start"},
    {"from": "val2", "to": "val3", "type": "finish_to_start"},
    {"from": "val3", "to": "ms4", "type": "finish_to_start"},
    {"from": "ms2", "to": "trans3", "type": "finish_to_start"},
    {"from": "ms3", "to": "load3", "type": "finish_to_start"}
  ],
  "date_markers": [
    {
      "id": "today",
      "name": "Today",
      "date": "2026-01-26",
      "color": "#4CAF50",
      "style": "solid"
    },
    {
      "id": "cutover",
      "name": "Cutover Date",
      "date": "2026-04-20",
      "color": "#F44336",
      "style": "dashed"
    },
    {
      "id": "go_live",
      "name": "Go-Live",
      "date": "2026-05-11",
      "color": "#9C27B0",
      "style": "dashed"
    }
  ],
  "risks": [
    {
      "id": "1",
      "name": "Data Quality Issues",
      "description": "Source data may have quality issues requiring additional cleansing",
      "severity": "high",
      "likelihood": "medium",
      "status": "open",
      "mitigation": "Early data profiling, automated quality checks",
      "affected": ["ext2", "ext3", "trans2"]
    },
    {
      "id": "2",
      "name": "Performance Bottleneck",
      "description": "Large data volumes may cause performance issues during load",
      "severity": "medium",
      "likelihood": "medium",
      "status": "monitoring",
      "mitigation": "Batch processing, parallel loads, off-peak scheduling",
      "affected": ["load3", "ms4"]
    }
  ]
}
